{
    "confidence": 0.5,
    "enhanced_text": [
        {
            "Patient Name": "PRAKASH BABU",
            "hospital_lab_location": "Vijayanagar, Bangalore",
            "hospital_lab_name": "Centre for Digestive and Liver Diseases",
            "parameters": [
                {
                    "Imaging Comment": "Rectum and Sigmoid colon: Normal vascular pattern. Hemorrhoiods present. Few dimunitive polyps noted in the Rectum-removed using biopsy forceps and sent for HPE. Transverse Colon : Normal vascular pattern. polyp, ulcer, tumor or stricture. Ascending Colon & Cecum : Normal vascular pattern. No polyp, ulcer, tumor or stricture. Normal cecum, ileocecal opening and appendicular opening. Terminal Ileum-Normal upto 10cms.",
                    "Impression": "DIMUNITIVE POLYPS IN THE RECTUM(s/p removal using biopsy forceps). FEW UNCLOMPLICATED COLONIC DIVERTICULI. GRADE 2 INTERNAL HEMORRHOIDS."
                }
            ],
            "test": "Colonoscopy report"
        }
    ],
    "extracted_text": "Dr. SATYAPRAKASH'S\nCentre for Digestive and Liver Diseases\nDr. B. S. Satya Prakash M.D., D.M., ( PGI ) FACG (USA)\nInternational Member: American Society of GI Endoscopy & European Society of GI Endoscopy\nPatient Name\nAge/Sex\nDate\n: 67/Male\n١٥\n: 23-Nov-2020\nRef. By\n: DR SP\nFinal Diagnosis\n:\n: PRAKASH BABU\nPatient Id\n: 30166\nDone By\n: Dr Manjunath Patil\nClinical Diagnosis\n: Ca COLON FOR SURVELLANCE.\nCOLONOSCOPY REPORT\nRectum and Sigmoid colon\nNormal vascular pattern. Hemorrhoiods present\nFew dimunitive polyps noted in the Rectum-removed using\nbiopsy forceps and sent for HPE.\nTransverse Colon :\nNormal vascular pattern.\npolyp, ulcer, tumor or stricture.\nAscending Colon & Cecum :\nNormal vascular pattern.\nNo polyp, ulcer, tumor or stricture.\nNormal cecum, ileocecal opening and appendicular opening.\nTerminal Ileum-Normal upto 10cms.\nFinal Diagnosis :\nDIMUNITIVE POLYPS IN THE RECTUM(s/p removal\nusing biopsy forceps).\nFEW UNCLOMPLICATED COLONIC DIVERTICULI.\nGRADE 2 INTERNAL HEMORRHOIDS.\nREMARKS-BIOPSY AWAITED.\nmp\nShakass\nTOM\nSES CEOFF TE\ni-scan\nUSB\n#229, 14th Cross, M.C Layout, Vijayanagar, Bangalore - 560 040\nPh: 9880017337, 23143216, 32986770, Fax: 23395284, www.drsatyaprakash.com, e-mail: satyaprakashbs@gmail.com\nLISB",
    "extraction_method": "gemini_2.0_flash",
    "file_path": "C:\\Users\\chinmay alse\\Desktop\\batch\\Endoscopy(Colonoscopy) (1).pdf",
    "file_processed": "Endoscopy(Colonoscopy) (1).pdf",
    "keywords_identified": [
        "colonoscopy",
        "rectum",
        "biopsy",
        "cecum"
    ],
    "processing_time": "22.24 seconds",
    "reason": "",
    "report_type": "COLONOSCOPY",
    "success": true,
    "timestamp": "2025-06-01 18:09:37",
    "verified_text": "[\n  {\n    \"test\": \"Colonoscopy report\",\n    \"hospital_lab_name\": \"Centre for Digestive and Liver Diseases\",\n    \"hospital_lab_location\": \"Vijayanagar, Bangalore\",\n    \"Patient Name\": \"PRAKASH BABU\",\n    \"parameters\": [\n      {\n        \"Impression\": \"DIMUNITIVE POLYPS IN THE RECTUM(s p removal using biopsy forceps). FEW UNCLOMPLICATED COLONIC DIVERTICULI. GRADE 2 INTERNAL HEMORRHOIDS.\",\n        \"Imaging Comment\": \"Rectum and Sigmoid colon: Normal vascular pattern. Hemorrhoiods present. Few dimunitive polyps noted in the Rectum-removed using biopsy forceps and sent for HPE. Transverse Colon : Normal vascular pattern. No polyp, ulcer, tumor or stricture. Ascending Colon & Cecum : Normal vascular pattern. No polyp, ulcer, tumor or stricture. Normal cecum, ileocecal opening and appendicular opening. Terminal Ileum-Normal upto 10cms.\"\n      }\n    ]\n  }\n]"
}